{"files":[{"bytes":424,"digest":"sha256:58ee9f01fb4948faf71ed7a3468d55563f3117faccecb8a3b1ebc81ff0aee649","path":"contracts/c0.json"},{"bytes":451,"digest":"sha256:e54143ef678a94cf7d4067eea887972e5f2f737f810cd0658e50601e5a9ceb74","path":"manifest.json"},{"bytes":543,"digest":"sha256:efe4b336ddc655a4a04bb20b7129cbf81603bb4ab0a2bbedfb370ca2fba5ec2b","path":"code/index.js"}],"manifestPath":"manifest.json","pluginId":"org.alica.echoa","schemaVersion":"alica.package-index/v1","version":"1.1.0"}